{
  "projection": "zones_catalog",
  "name": "Зоны доставки",
  "domain": "delivery",
  "layer": "canonical",
  "archetype": "catalog",
  "version": 2,
  "generatedAt": 0,
  "generatedBy": "rules",
  "inputsHash": "accept_assignment,accept_order,add_to_cart,adjust_eta,agent_auto_assign_courier,agent_auto_notify_customer,agent_auto_reassign,agent_auto_release_hold,assign_courier_manual,cancel_order,confirm_delivery,confirm_pickup,create_dispatcher_assignment,create_draft_order,escalate_order,foreign_geocode_ready,foreign_ingest_location,foreign_notification_sent,foreign_payment_webhook,go_online,mark_ready,pause_orders_reception,pause_zone,place_order,rate_delivery,reassign_delivery,reject_assignment,reject_order,remove_from_cart,report_issue,request_refund,resume_orders_reception,rule_cancel_stale_order,rule_escalate_order,rule_notify_cooking_delay,rule_reassign_delivery,rule_release_expired_hold,rule_send_review_reminder,set_delivery_address,set_stop_list_item,start_cooking,start_delivery,tip_courier,update_cart_quantity,update_menu_item|active_delivery,assignments_form,cart,cart_edit,checkout,courier_lobby,couriers_list,customer_home,delivery_history,dispatcher_map,earnings_dashboard,kds_board,menu_detail,menu_management,merchant_analytics,merchant_catalog,order_detail,order_detail_edit,order_history,order_tracker,orders_feed,preapproval_form,preapprovals_list,scheduled_timers_debug,settings,stop_list,zones_catalog|Address,AgentPreapproval,CourierLocation,Delivery,DispatcherAssignment,MenuItem,Merchant,Notification,Order,OrderItem,Payment,Review,User,Zone",
  "slots": {
    "header": [],
    "toolbar": [],
    "hero": [],
    "body": {
      "type": "list",
      "source": "zones",
      "gap": 8,
      "empty": {
        "type": "text",
        "content": "Пусто",
        "style": "muted"
      },
      "item": {
        "type": "card",
        "children": [
          {
            "type": "row",
            "gap": 10,
            "children": [
              {
                "type": "avatar",
                "bind": "avatar",
                "nameBind": "name",
                "size": 40
              },
              {
                "type": "column",
                "sx": {
                  "flex": 1
                },
                "children": [
                  {
                    "type": "text",
                    "bind": "name",
                    "style": "heading"
                  }
                ]
              }
            ]
          }
        ],
        "intents": []
      },
      "sort": "name"
    },
    "context": [],
    "fab": [],
    "overlay": []
  },
  "nav": {
    "outgoing": [],
    "incoming": []
  },
  "editProjection": null,
  "sourceProjection": null
}
