{
  "projection": "hypothesis_list",
  "name": "Гипотезы",
  "domain": "reflect",
  "layer": "canonical",
  "archetype": "catalog",
  "version": 2,
  "generatedAt": 0,
  "generatedBy": "rules",
  "inputsHash": "add_activity_to_entry,add_tag_to_entry,archive_activity,archive_hypothesis,auto_resolve_hypothesis,award_milestone,compute_correlation,confirm_hypothesis,create_activity,create_reminder,create_tag,delete_account,delete_activity,delete_entry,delete_hypothesis,delete_reminder,delete_tag,detailed_checkin,detect_pattern,dismiss_insight,duplicate_entry,edit_activity,edit_entry_note,edit_hypothesis,edit_reminder,edit_tag,evaluate_hypothesis,export_data,generate_insight,mark_insight_seen,merge_activities,merge_tags,mood_drift_alert,move_entry_time,pin_insight,propose_hypothesis,quick_checkin,reject_hypothesis,remove_activity_from_entry,remove_tag_from_entry,reset_progress,set_avatar,start_testing,toggle_reminder,update_profile,update_streak,weekly_summary|activity_correlation,activity_list,calendar_heatmap,checkin,entry_detail,hypothesis_detail,hypothesis_detail_edit,hypothesis_list,insights_feed,mood_meter_cluster,mood_trends,tag_list,timeline,weekly_summary,weekly_summary_edit|Activity,EntryActivity,EntryTag,Hypothesis,HypothesisEvidence,Insight,MoodEntry,Reminder,Tag,User",
  "slots": {
    "header": [],
    "toolbar": [],
    "hero": [
      {
        "type": "heroCreate",
        "intentId": "propose_hypothesis",
        "paramName": "title",
        "placeholder": "Название…",
        "buttonLabel": "Предложить гипотезу",
        "icon": "⚡",
        "postCreate": {
          "collection": "hypothesises",
          "matchField": "status",
          "matchValue": "testing",
          "navigateTo": "hypothesis_detail_edit",
          "idParam": "hypothesisId"
        }
      }
    ],
    "body": {
      "type": "list",
      "source": "hypothesises",
      "gap": 8,
      "empty": {
        "type": "text",
        "content": "Пусто",
        "style": "muted"
      },
      "item": {
        "type": "card",
        "children": [
          {
            "type": "row",
            "gap": 10,
            "children": [
              {
                "type": "avatar",
                "bind": "avatar",
                "nameBind": "title",
                "size": 40
              },
              {
                "type": "column",
                "sx": {
                  "flex": 1
                },
                "children": [
                  {
                    "type": "text",
                    "bind": "title",
                    "style": "heading"
                  },
                  {
                    "type": "text",
                    "bind": "status",
                    "style": "secondary"
                  }
                ]
              }
            ]
          }
        ],
        "intents": [
          {
            "intentId": "start_testing",
            "label": "Начать тестирование",
            "icon": "⚡",
            "conditions": [
              "hypothesis.userId = me.id",
              "hypothesis.userId = me.id"
            ]
          },
          {
            "intentId": "confirm_hypothesis",
            "label": "Подтвердить",
            "icon": "✓",
            "conditions": [
              "hypothesis.userId = me.id",
              "hypothesis.userId = me.id"
            ]
          },
          {
            "intentId": "reject_hypothesis",
            "label": "Опровергнуть",
            "icon": "🚫",
            "conditions": [
              "hypothesis.userId = me.id",
              "hypothesis.userId = me.id"
            ]
          },
          {
            "intentId": "archive_hypothesis",
            "label": "Архивировать",
            "icon": "📦",
            "conditions": [
              "hypothesis.userId = me.id",
              "hypothesis.userId = me.id"
            ]
          },
          {
            "intentId": "delete_hypothesis",
            "opens": "overlay",
            "overlayKey": "overlay_delete_hypothesis",
            "label": "Удалить",
            "icon": "🗑",
            "conditions": [
              "hypothesis.userId = me.id"
            ]
          },
          {
            "intentId": "edit_hypothesis",
            "opens": "overlay",
            "overlayKey": "overlay_edit_hypothesis",
            "label": "Редактировать",
            "icon": "✎",
            "conditions": [
              "hypothesis.userId = me.id",
              "hypothesis.userId = me.id"
            ]
          }
        ]
      },
      "filter": "userId === viewer.id && status !== 'archived'",
      "onItemClick": {
        "action": "navigate",
        "to": "hypothesis_detail",
        "params": {
          "hypothesisId": "item.id"
        }
      }
    },
    "context": [],
    "fab": [],
    "overlay": [
      {
        "type": "confirmDialog",
        "key": "overlay_delete_hypothesis",
        "triggerIntentId": "delete_hypothesis",
        "irreversibility": "medium",
        "message": "Удалить?",
        "confirmBy": {
          "type": "button"
        }
      },
      {
        "type": "formModal",
        "key": "overlay_edit_hypothesis",
        "intentId": "edit_hypothesis",
        "title": "Редактировать",
        "witnessPanel": [],
        "parameters": [
          {
            "name": "title",
            "inferredFrom": "direct-witness",
            "control": "text"
          },
          {
            "name": "whenActivity",
            "inferredFrom": "direct-witness",
            "control": "text"
          },
          {
            "name": "expectedEffect",
            "inferredFrom": "direct-witness",
            "control": "select",
            "options": [
              {
                "value": "more_energy",
                "label": "Больше энергии"
              },
              {
                "value": "less_stress",
                "label": "Меньше стресса"
              },
              {
                "value": "more_pleasantness",
                "label": "Больше радости"
              },
              {
                "value": "less_pleasantness",
                "label": "Меньше радости"
              },
              {
                "value": "more_calm",
                "label": "Больше спокойствия"
              },
              {
                "value": "more_focus",
                "label": "Больше фокуса"
              }
            ]
          }
        ]
      }
    ]
  },
  "nav": {
    "outgoing": [
      {
        "from": "hypothesis_list",
        "to": "hypothesis_detail",
        "kind": "item-click",
        "itemEntity": "Hypothesis",
        "params": {
          "hypothesisId": "item.id"
        }
      }
    ],
    "incoming": []
  },
  "editProjection": null,
  "sourceProjection": null
}
