{
  "projection": "specialist_schedule",
  "name": "Расписание",
  "domain": "booking",
  "layer": "canonical",
  "archetype": "catalog",
  "version": 2,
  "generatedAt": 0,
  "generatedBy": "rules",
  "inputsHash": "abandon_draft,add_service,block_slot,bulk_cancel_day,cancel_booking,cancel_client_booking,complete_booking,confirm_booking,create_booking,delete_review,edit_review,leave_review,mark_no_show,remove_service,repeat_booking,reschedule_booking,respond_to_review,select_service,select_slot,studio_test_intent_zzz,unblock_slot,update_service|booking_detail,booking_wizard,my_bookings,service_catalog,service_detail,service_detail_edit,specialist_schedule|Booking,Review,Service,ServiceCategory,Specialist,TimeSlot",
  "slots": {
    "header": [],
    "toolbar": [],
    "hero": [],
    "body": {
      "type": "list",
      "source": "timeslots",
      "gap": 8,
      "empty": {
        "type": "text",
        "content": "Пусто",
        "style": "muted"
      },
      "item": {
        "type": "card",
        "children": [
          {
            "type": "row",
            "gap": 10,
            "children": [
              {
                "type": "avatar",
                "bind": "avatar",
                "nameBind": "id",
                "size": 40
              },
              {
                "type": "column",
                "sx": {
                  "flex": 1
                },
                "children": [
                  {
                    "type": "text",
                    "bind": "id",
                    "style": "heading"
                  },
                  {
                    "type": "text",
                    "bind": "status",
                    "style": "secondary"
                  }
                ]
              }
            ]
          }
        ],
        "intents": [
          {
            "intentId": "block_slot",
            "label": "Заблокировать слот",
            "icon": "🚫",
            "conditions": [
              "slot.status = 'free'",
              "slot.specialistId = me.id"
            ]
          },
          {
            "intentId": "unblock_slot",
            "label": "Разблокировать слот",
            "icon": "✓",
            "conditions": [
              "slot.status = 'blocked'",
              "slot.specialistId = me.id"
            ]
          }
        ]
      },
      "filter": "status === 'free'",
      "sort": "date"
    },
    "context": [],
    "fab": [],
    "overlay": []
  },
  "nav": {
    "outgoing": [],
    "incoming": []
  },
  "editProjection": null,
  "sourceProjection": null
}
