{
  "projection": "weekly_summary_edit",
  "name": "Итоги недели: редактирование",
  "domain": "reflect",
  "layer": "canonical",
  "archetype": "form",
  "version": 2,
  "generatedAt": 0,
  "generatedBy": "rules",
  "inputsHash": "add_activity_to_entry,add_tag_to_entry,archive_activity,archive_hypothesis,auto_resolve_hypothesis,award_milestone,compute_correlation,confirm_hypothesis,create_activity,create_reminder,create_tag,delete_account,delete_activity,delete_entry,delete_hypothesis,delete_reminder,delete_tag,detailed_checkin,detect_pattern,dismiss_insight,duplicate_entry,edit_activity,edit_entry_note,edit_hypothesis,edit_reminder,edit_tag,evaluate_hypothesis,export_data,generate_insight,mark_insight_seen,merge_activities,merge_tags,mood_drift_alert,move_entry_time,pin_insight,propose_hypothesis,quick_checkin,reject_hypothesis,remove_activity_from_entry,remove_tag_from_entry,reset_progress,set_avatar,start_testing,toggle_reminder,update_profile,update_streak,weekly_summary|activity_correlation,activity_list,calendar_heatmap,checkin,entry_detail,hypothesis_detail,hypothesis_detail_edit,hypothesis_list,insights_feed,mood_meter_cluster,mood_trends,tag_list,timeline,weekly_summary,weekly_summary_edit|Activity,EntryActivity,EntryTag,Hypothesis,HypothesisEvidence,Insight,MoodEntry,Reminder,Tag,User",
  "slots": {
    "header": [],
    "toolbar": [],
    "body": {
      "type": "formBody",
      "mainEntity": "User",
      "fields": [
        {
          "name": "name",
          "type": "text",
          "editable": true,
          "required": true,
          "label": "Имя",
          "intentId": "update_profile",
          "options": null
        },
        {
          "name": "email",
          "type": "email",
          "editable": false,
          "required": true,
          "label": "Email",
          "intentId": null,
          "options": null
        },
        {
          "name": "avatar",
          "type": "text",
          "editable": true,
          "required": false,
          "label": "Аватар",
          "intentId": "set_avatar",
          "options": null
        },
        {
          "name": "streakCurrent",
          "type": "number",
          "editable": false,
          "required": false,
          "label": "Текущая серия",
          "intentId": null,
          "options": null
        },
        {
          "name": "entryCount",
          "type": "number",
          "editable": false,
          "required": false,
          "label": "Количество записей",
          "intentId": null,
          "options": null
        }
      ],
      "sections": [
        {
          "id": "main",
          "title": "Основное",
          "fields": [
            {
              "name": "name",
              "type": "text",
              "editable": true,
              "required": true,
              "label": "Имя",
              "intentId": "update_profile",
              "options": null
            }
          ]
        },
        {
          "id": "attrs",
          "title": "Характеристики",
          "fields": [
            {
              "name": "avatar",
              "type": "text",
              "editable": true,
              "required": false,
              "label": "Аватар",
              "intentId": "set_avatar",
              "options": null
            }
          ]
        }
      ],
      "editIntents": [
        "update_profile",
        "set_avatar"
      ]
    },
    "context": [],
    "fab": [],
    "overlay": []
  },
  "nav": {
    "outgoing": [],
    "incoming": [
      {
        "from": "weekly_summary",
        "to": "weekly_summary_edit",
        "kind": "edit-action",
        "itemEntity": "User",
        "params": {
          "userId": "routeParams.userId"
        }
      }
    ]
  },
  "editProjection": null,
  "sourceProjection": "weekly_summary"
}
